<?xml version="1.0" encoding="UTF-8"?>
<tutorials_progetti xmlns:xsi="http://www.w3.org/2001/XMLSchema-instance" xsi:noNamespaceSchemaLocation="../../structures/tutorials_progetti.xsd" ultimo_id="1">
  <tutorial_progetto id="1" id_progetto="1">
    <step num_step="1" nome_file_img="img/steps/img_step_659bd05245a40.jpg">
      <descrizione>Collegare arduino al pc con un cavo usb tipo B - tipo A.</descrizione>
    </step>
    <step num_step="2" nome_file_img="img/steps/img_step_659bd097b7901.png">
      <descrizione>Aprire l'ide di programmazione arduino e caricare lo sketch di default chiamato "blink"</descrizione>
    </step>
    <step num_step="3" nome_file_img="img/steps/img_step_659bd141ef448.jpg">
      <descrizione>Collegare con i jump, il pin 9 analogico di arduino sull'anodo del led, e la massa sul catodo. Infine avviare lo sketch caricandolo su arduino.</descrizione>
    </step>
  </tutorial_progetto>
</tutorials_progetti>
